<?xml version="1.0" encoding='UTF-8'?>
<!DOCTYPE node SYSTEM "node.dtd">

<!--

 Copyright (C) 2009-2010 Simon Dawson

 This file is part of Phloem.

    Phloem is free software: you can redistribute it and/or modify
    it under the terms of the GNU General Public License as published by
    the Free Software Foundation, either version 3 of the License, or
    (at your option) any later version.

    Phloem is distributed in the hope that it will be useful,
    but WITHOUT ANY WARRANTY; without even the implied warranty of
    MERCHANTABILITY or FITNESS FOR A PARTICULAR PURPOSE.  See the
    GNU General Public License for more details.

    You should have received a copy of the GNU General Public License
    along with Phloem.  If not, see <http://www.gnu.org/licenses/>.

-->

<node id="testroot" group="testers" is_root="1" host="10.127.10.4">

  <description>
    This is a dummy root node, for testing purposes.
  </description>

  <root host="10.127.10.4" port="9999" />

  <rsync user="simond"
    ssh_id_file="etc/.ssh/id_rsa"
    ssh_port="22" />

  <role type="publish" route="root2leaf">
    <directory path="/home/simond/Projects/Personal/svn/phloem/testroot/root2leaf/" />
    <description>
      Publish root2leaf content.
    </description>
  </role>

  <role type="subscribe" route="leaf2root" active="1">
    <directory path="/home/simond/Projects/Personal/svn/phloem/testroot/leaf2root/" />
    <filter type="node" value="^test\w+" rule="match" />
    <description>
      Subscribe to leaf2root content from matching publisher nodes.
    </description>
  </role>

</node>
